[
  {
    "id": "mass_rectangular_prism",
    "version": 1,
    "titleRu": "Масса прямоугольного параллелепипеда",
    "classification": "physics_verified",
    "expression": [
      "V=a*b*h",
      "m=rho*V"
    ],
    "inputs": [
      {
        "key": "a",
        "unit": "m",
        "descriptionRu": "длина"
      },
      {
        "key": "b",
        "unit": "m",
        "descriptionRu": "ширина"
      },
      {
        "key": "h",
        "unit": "m",
        "descriptionRu": "толщина"
      },
      {
        "key": "rho",
        "unit": "kg/m3",
        "descriptionRu": "плотность"
      }
    ],
    "outputs": [
      {
        "key": "V",
        "unit": "m3",
        "descriptionRu": "объём"
      },
      {
        "key": "m",
        "unit": "kg",
        "descriptionRu": "масса"
      }
    ],
    "assumptions": [],
    "warnings": [],
    "sourceIds": [],
    "reviewStatus": "automatic"
  },
  {
    "id": "mass_solid_cylinder",
    "version": 1,
    "titleRu": "Масса сплошного цилиндра",
    "classification": "physics_verified",
    "expression": [
      "A=pi*d^2/4",
      "V=A*L",
      "m=rho*V"
    ],
    "inputs": [
      {
        "key": "d",
        "unit": "m",
        "descriptionRu": "диаметр"
      },
      {
        "key": "L",
        "unit": "m",
        "descriptionRu": "длина"
      },
      {
        "key": "rho",
        "unit": "kg/m3",
        "descriptionRu": "плотность"
      }
    ],
    "outputs": [
      {
        "key": "A",
        "unit": "m2",
        "descriptionRu": "площадь"
      },
      {
        "key": "V",
        "unit": "m3",
        "descriptionRu": "объём"
      },
      {
        "key": "m",
        "unit": "kg",
        "descriptionRu": "масса"
      }
    ],
    "assumptions": [],
    "warnings": [],
    "sourceIds": [],
    "reviewStatus": "automatic"
  },
  {
    "id": "mass_hollow_cylinder",
    "version": 1,
    "titleRu": "Масса полого цилиндра",
    "classification": "physics_verified",
    "expression": [
      "A=pi*(D^2-d^2)/4",
      "V=A*L",
      "m=rho*V"
    ],
    "inputs": [
      {
        "key": "D",
        "unit": "m",
        "descriptionRu": "наружный диаметр"
      },
      {
        "key": "d",
        "unit": "m",
        "descriptionRu": "внутренний диаметр"
      },
      {
        "key": "L",
        "unit": "m",
        "descriptionRu": "длина"
      },
      {
        "key": "rho",
        "unit": "kg/m3",
        "descriptionRu": "плотность"
      }
    ],
    "outputs": [
      {
        "key": "m",
        "unit": "kg",
        "descriptionRu": "масса"
      }
    ],
    "assumptions": [
      "D>d"
    ],
    "warnings": [],
    "sourceIds": [],
    "reviewStatus": "automatic"
  },
  {
    "id": "power_torque_speed",
    "version": 1,
    "titleRu": "Связь мощности, момента и частоты",
    "classification": "physics_verified",
    "expression": [
      "omega=2*pi*n/60",
      "P=T*omega",
      "T=9550*P_kW/n_rpm"
    ],
    "inputs": [
      {
        "key": "P_kW",
        "unit": "kW",
        "descriptionRu": "мощность"
      },
      {
        "key": "n_rpm",
        "unit": "rpm",
        "descriptionRu": "частота"
      }
    ],
    "outputs": [
      {
        "key": "T",
        "unit": "N*m",
        "descriptionRu": "момент"
      }
    ],
    "assumptions": [
      "стационарное вращение без учёта КПД"
    ],
    "warnings": [],
    "sourceIds": [],
    "reviewStatus": "automatic"
  },
  {
    "id": "linear_thermal_expansion",
    "version": 1,
    "titleRu": "Линейное тепловое расширение",
    "classification": "physics_verified",
    "expression": [
      "deltaL=alpha*L*deltaT",
      "L2=L+deltaL"
    ],
    "inputs": [
      {
        "key": "alpha",
        "unit": "1/K",
        "descriptionRu": "коэффициент"
      },
      {
        "key": "L",
        "unit": "m",
        "descriptionRu": "исходная длина"
      },
      {
        "key": "deltaT",
        "unit": "K",
        "descriptionRu": "изменение температуры"
      }
    ],
    "outputs": [
      {
        "key": "deltaL",
        "unit": "m",
        "descriptionRu": "изменение длины"
      },
      {
        "key": "L2",
        "unit": "m",
        "descriptionRu": "новая длина"
      }
    ],
    "assumptions": [
      "alpha постоянен в диапазоне температуры"
    ],
    "warnings": [],
    "sourceIds": [],
    "reviewStatus": "automatic"
  },
  {
    "id": "liquid_volume_by_density",
    "version": 1,
    "titleRu": "Изменение объёма жидкости по плотности",
    "classification": "physics_verified",
    "expression": [
      "m=rho1*V1",
      "V2=m/rho2",
      "deltaV=V2-V1"
    ],
    "inputs": [
      {
        "key": "V1",
        "unit": "m3",
        "descriptionRu": "начальный объём"
      },
      {
        "key": "rho1",
        "unit": "kg/m3",
        "descriptionRu": "плотность при T1"
      },
      {
        "key": "rho2",
        "unit": "kg/m3",
        "descriptionRu": "плотность при T2"
      }
    ],
    "outputs": [
      {
        "key": "V2",
        "unit": "m3",
        "descriptionRu": "конечный объём"
      },
      {
        "key": "deltaV",
        "unit": "m3",
        "descriptionRu": "изменение"
      }
    ],
    "assumptions": [
      "замкнутая масса без утечки"
    ],
    "warnings": [
      "Плотности должны поступать из проверенной температурной таблицы"
    ],
    "sourceIds": [],
    "reviewStatus": "automatic"
  },
  {
    "id": "axial_bar",
    "version": 1,
    "titleRu": "Осевое напряжение и удлинение стержня",
    "classification": "physics_verified",
    "expression": [
      "sigma=F/A",
      "deltaL=F*L/(E*A)"
    ],
    "inputs": [
      {
        "key": "F",
        "unit": "N",
        "descriptionRu": "сила"
      },
      {
        "key": "A",
        "unit": "m2",
        "descriptionRu": "площадь"
      },
      {
        "key": "L",
        "unit": "m",
        "descriptionRu": "длина"
      },
      {
        "key": "E",
        "unit": "Pa",
        "descriptionRu": "модуль Юнга"
      }
    ],
    "outputs": [
      {
        "key": "sigma",
        "unit": "Pa",
        "descriptionRu": "напряжение"
      },
      {
        "key": "deltaL",
        "unit": "m",
        "descriptionRu": "удлинение"
      }
    ],
    "assumptions": [
      "линейная упругость",
      "центральное растяжение"
    ],
    "warnings": [],
    "sourceIds": [],
    "reviewStatus": "automatic"
  },
  {
    "id": "solid_shaft_torsion",
    "version": 1,
    "titleRu": "Кручение сплошного круглого вала",
    "classification": "physics_verified",
    "expression": [
      "J=pi*d^4/32",
      "tauMax=T*(d/2)/J=16*T/(pi*d^3)",
      "phi=T*L/(G*J)"
    ],
    "inputs": [
      {
        "key": "T",
        "unit": "N*m",
        "descriptionRu": "момент"
      },
      {
        "key": "d",
        "unit": "m",
        "descriptionRu": "диаметр"
      },
      {
        "key": "L",
        "unit": "m",
        "descriptionRu": "длина"
      },
      {
        "key": "G",
        "unit": "Pa",
        "descriptionRu": "модуль сдвига"
      }
    ],
    "outputs": [
      {
        "key": "J",
        "unit": "m4",
        "descriptionRu": "полярный момент"
      },
      {
        "key": "tauMax",
        "unit": "Pa",
        "descriptionRu": "максимальное касательное напряжение"
      },
      {
        "key": "phi",
        "unit": "rad",
        "descriptionRu": "угол закручивания"
      }
    ],
    "assumptions": [
      "круглый призматический вал",
      "линейная упругость"
    ],
    "warnings": [],
    "sourceIds": [],
    "reviewStatus": "automatic"
  },
  {
    "id": "hollow_shaft_torsion",
    "version": 1,
    "titleRu": "Кручение полого круглого вала",
    "classification": "physics_verified",
    "expression": [
      "J=pi*(D^4-d^4)/32",
      "tauMax=T*(D/2)/J",
      "phi=T*L/(G*J)"
    ],
    "inputs": [
      {
        "key": "T",
        "unit": "N*m",
        "descriptionRu": "момент"
      },
      {
        "key": "D",
        "unit": "m",
        "descriptionRu": "наружный диаметр"
      },
      {
        "key": "d",
        "unit": "m",
        "descriptionRu": "внутренний диаметр"
      },
      {
        "key": "L",
        "unit": "m",
        "descriptionRu": "длина"
      },
      {
        "key": "G",
        "unit": "Pa",
        "descriptionRu": "модуль сдвига"
      }
    ],
    "outputs": [
      {
        "key": "tauMax",
        "unit": "Pa",
        "descriptionRu": "напряжение"
      },
      {
        "key": "phi",
        "unit": "rad",
        "descriptionRu": "угол"
      }
    ],
    "assumptions": [
      "D>d"
    ],
    "warnings": [],
    "sourceIds": [],
    "reviewStatus": "automatic"
  },
  {
    "id": "beam_ss_center_point",
    "version": 1,
    "titleRu": "Шарнирная балка, сила в середине",
    "classification": "physics_verified",
    "expression": [
      "R1=R2=P/2",
      "Mmax=P*L/4",
      "fmax=P*L^3/(48*E*I)"
    ],
    "inputs": [
      {
        "key": "P",
        "unit": "N",
        "descriptionRu": "сила"
      },
      {
        "key": "L",
        "unit": "m",
        "descriptionRu": "пролёт"
      },
      {
        "key": "E",
        "unit": "Pa",
        "descriptionRu": "модуль"
      },
      {
        "key": "I",
        "unit": "m4",
        "descriptionRu": "момент инерции"
      }
    ],
    "outputs": [
      {
        "key": "Mmax",
        "unit": "N*m",
        "descriptionRu": "максимальный момент"
      },
      {
        "key": "fmax",
        "unit": "m",
        "descriptionRu": "прогиб"
      }
    ],
    "assumptions": [
      "Эйлер–Бернулли",
      "малые прогибы"
    ],
    "warnings": [],
    "sourceIds": [],
    "reviewStatus": "automatic"
  },
  {
    "id": "beam_ss_udl",
    "version": 1,
    "titleRu": "Шарнирная балка, равномерная нагрузка",
    "classification": "physics_verified",
    "expression": [
      "R1=R2=q*L/2",
      "Mmax=q*L^2/8",
      "fmax=5*q*L^4/(384*E*I)"
    ],
    "inputs": [